{
  "finding_id": "GHSA-4gp8-rjrq-ch6q",
  "type": "ssrf.oast",
  "target": {
    "expected_origin": "http://127.0.0.1:8099",
    "allowed_hosts": ["127.0.0.1"],
    "allowed_schemes": ["http"],
    "allowed_ports": [8099]
  },
  "auth": {
    "required": false
  },
  "evidence": {
    "request": {
      "method": "GET",
      "url": "http://127.0.0.1:8099/preview?url=http%3A%2F%2Fplaceholder.invalid"
    },
    "injection_location": {
      "kind": "query",
      "name": "url"
    },
    "expected_protocols": ["http"]
  },
  "proof": {
    "expected_signal": "oast_interaction",
    "poll_window_seconds": 45,
    "require_source_not_verifier": true
  }
}
